{
  "$schema": "http://json-schema.org/draft-07/schema#",
  "$id": "https://github.com/shelf-project/shelf/shelf-advisor/schema/recommendation.schema.json",
  "title": "Recommendation",
  "description": "One advisor recommendation row. Common shape across every recommender in the shelf-advisor binary; recommendation_type narrows to a per-kind rationale + suggested_change shape (see optimize_recommendation.schema.json, pinlist_recommendation.schema.json).",
  "type": "object",
  "additionalProperties": false,
  "required": [
    "recommendation_type",
    "table",
    "confidence",
    "rationale",
    "suggested_change"
  ],
  "properties": {
    "recommendation_type": {
      "type": "string",
      "description": "Discriminator: optimize_targets | pin_list_candidates | bloom_filter_columns | mv_candidates."
    },
    "table": {
      "type": "string",
      "pattern": "^[A-Za-z_][\\w]*\\.[A-Za-z_][\\w]*\\.[A-Za-z_][\\w]*$",
      "description": "Fully-qualified catalog.schema.table the recommendation applies to."
    },
    "confidence": {
      "type": "number",
      "minimum": 0.0,
      "maximum": 1.0,
      "description": "Confidence in [0,1]. >=0.8 = ship without review; 0.5..0.8 = needs ops eyeballs."
    },
    "rationale": {
      "type": "object",
      "description": "Per-recommender scoring inputs. Free-form so each recommender can attach its own numeric breakdown."
    },
    "suggested_change": {
      "type": "object",
      "description": "Per-recommender concrete change (alter_table SQL, pin_list_entry, etc.)."
    }
  }
}
